media,time,body
연합뉴스,"['2017.01.01. 오전 11:00', '2017.01.02. 오전 5:29']","['\n\t', '\n\t', '\n\n', '\n', '\n\t\n\t', '한국감정원 지난해 주택시장 결산', '(서울=연합뉴스) 서미숙 기자 = 지난해 주택시장은 매매, 전세 모두 대체로 안정세를 보였다.', '    1일 한국감정원에 따르면 지난해 전국의 주택 매매가격은 전년도에 비해 0.71% 상승했다. 2014년의 1.71%, 2015년의 3.51%에 비해 오름폭이 둔화한 것이다.', '    지난해 청약시장이 과열되고 분양가가 상승하면서 서울 재건축 아파트를 중심으로 국지적 강세를 보였으나 정부의 11·3 부동산 안정대책과 금리 인상, 대출규제 강화 등 규제로 인해 11월 이후 하락 전환했다.', '    지방의 경우엔 입주물량 증가와 조선·해운 구조조정 등의 영향으로 줄곧 약세가 이어졌다.', '    지역별로 수도권이 1.32%, 지방이 0.17% 각각 상승했다.', '    제주도가 4.63%로 가장 큰 폭으로 올랐고 부산(3.18%), 서울(2.14%), 강원(1.33%) 등지도 가격이 상승했다. ', '    이에 비해 신규 주택 입주가 몰린 대구(-1.84%), 경북(-1.66%), 충남(-1.51%) 등지는 하락했다.', '    유형별로는 2015년에 4.89% 올랐던 아파트가 지난해는 0.76% 상승했고, 단독주택(0.76%)과 연립주택(0.41%) 오름폭도 각각 2015년에 비해 둔화됐다.', '    전세시장은 수도권 신도시를 비롯해 입주물량이 증가하면서 예년에 비해 안정된 모습이었다.', '    지난해 전국의 주택 전셋값은 2015년(4.85%)보다 낮은 1.32% 상승했다.', '    세종시가 4.0%로 가장 많이 올랐고 부산(2.90%), 인천(2.25%), 경기(2.06%) 등의 순으로 상승했다. ', '    이에 비해 대구(-1.59%), 경북(-1.08%), 충남(-0.96%) 등은 매매와 함께 전세도 약세를 보였다.', '    지난 2015년 7.25% 올랐던 서울의 전셋값은 지난해 1.95%로 오름폭이 크게 둔화됐다.', '    유형별로는 아파트(1.89%), 연립주택(0.72%), 단독주택(0.36%) 순으로 오름세를 보였다.', '    월세는 보증금 비중이 높은 준전세가 0.67% 상승했으나 보증금 비중이 작은 월세와 준월세는 각각 0.66%, 0.36% 하락했다.', '    한국감정원 강여정 부장은 ""정부의 11·3 대책 발표와 미국 기준금리 인상, 대출 규제 이후 주택시장이 관망세로 접어든 상태""라며 ""계절적 비수기에 다 국내 산업경기 회복 지연, 공급과잉 우려 등까지 겹치면서 본격적인 봄이사철이 오기 전까지는 주택 가격이 상승하기 어려울 것""이라고 말했다. ', 'sms@yna.co.kr', '\n\t', '\n\t']"
이데일리,['2017.01.01. 오전 11:34'],"['\n\t', '\n\t', '\n\n', '\n', '\n\t\n\t', '[이데일리 성문재 기자] 박정원 두산(000150)그룹 회장이 새해 재무건정성 강화에 집중하겠다는 의지를 밝혔다. 면세점 등 신규사업의 안정화 작업도 지속적으로 전개해나갈 예정이다.', '취임 2년차를 맞이한 박정원 회장은 1일 신년사를 통해 “미국 새 행정부 출범, 미국 금리인상과 원자재 시장 변동성, 보호주의적 통상 정책 확대 등이 올한해 주요 경영환경 변수”라며 “무엇보다 수익구조의 근본적인 개선으로 재무건전성을 더욱 강화해 나갈 것”이라고 강조했다.', '박 회장은 임직원들에게 “새로운 변수들로 인해 경영환경의 불확실성이 더욱 커진 만큼 각오를 단단히 하고, 하나로 모은 역량을 바탕으로 성과를 창출하는 ‘위닝 팀(Winning Team)’을 만들자”고 당부했다.', '또한 사업의 근원적 경쟁력 확보를 통해 시장점유율을 지속적으로 확대하고, 신규사업 및 신규시장을 선도적으로 개척해 나가야 한다고 강조했다. 그는 “탁월한 경쟁력을 바탕으로 시장선도자로서의 경쟁우위를 확고히 해야 한다”고 주문했다.', '박 회장은 작년 3월 취임 이후 성과에 대해 “어려운 여건 속에서도 재무구조 강화에 성과를 거뒀고, 신규 사업들은 차질 없이 진척되고 있다”고 자평했다. 취임 초부터 강조했던 현장 중시 기업문화에 대해서는 “현장은 기업 활동의 핵심이며 현장의 성과가 곧 그룹의 성과”라며 올해도 이같은 방침을 강조할 것임을 확인시켰다.', '박정원 회장은 “하나로 모은 역량을 바탕으로 이제는 성과를 창출하는 ‘Winning Team’으로 갈 때”라며 “이를 위해선 솔선수범의 자세로 조직원의 역량 발현을 뒷받침하는 리더의 역할이 무엇보다 중요하다”고 덧붙였다.', '성문재 (mjseong@edaily.co.kr)', '\n\t', '\n\t']"
이데일리,"['A13면 1단', '2017.01.01. 오전 11:42', '2017.01.02. 오전 9:23']","['\n\t', '\n\t', '\n\n', '\n', '\n\t\n\t', '[이데일리 노희준 기자] 금융당국의 저소득 저신용자 등을 대상으로 한 가계부채 연착륙 대책이 표류하고 있다. 연체부담을 획기적으로 줄여주려는 당국과 그럴 경우 대출자의 모럴해저드를 유발할 수 있다며 반발하는 은행권 사이에 이견이 커 난항을 겪고 있기 때문이다. 이에 따라 오는 5일 금융당국 업무보고에선 관련 대책 발표가 유보될 것으로 전해졌다. ', '2일 금융당국과 금융권에 따르면 금융위원회와 금융감독원은 은행권과 TF를 가동해 금리상승 위험에 취약한 저소득(소득 하위 30%)·저신용자(신용등급 7~10등급)·다중채무자(금융기관 3곳 이상에서 빚을 진 경우)의 연체부담을 완화하는 방안을 논의하고 있다. 하지만 이견이 심해 당분간 합의에 이르긴 어려울 전망이다. ', '가장 큰 쟁점은 연체이자 부과체계의 변경방안이다. 현재는 기한의이익 상실(채권 만기전 회수)시점인 3개월(담보대출)을 기준으로 그 이전에는 이자에, 그 후로는 원금에 연체이자를 부과하고 있다. 하지만 금융당국은 앞으로는 연체 3개월부터라도 이자에만 연체이자를 매기자는 방안을 추진하고 있다. 이 시점부터 크게 불어나는 ‘연체금리 폭탄’을 줄이자는 의도다. ', '하지만 은행권은 대출자의 모럴해저드를 유발할 수 있다며 반발하고 있다. A은행 관계자는 “이 같은 방안이 현실화되면 연체이자가 적어져 대출자의 연체 해소의지가 꺾일 수밖에 없다”며 “오히려 금융기관 연체가 늘어나는 역효과가 있을 것”이라고 말했다. ', '연체금리 인하 방안에 대해서도 이견이 크다. 현 연체금리는 연 11~18%의 은행별 최고연체금리 이내에서 기간별로 대출금리에 가산금리를 적용하는 방식이다. 연체 1개월 이하에는 6%, 3개월 이하면 7%, 3개월 초과에는 8%식으로 연체기간이 길수록 가산금리를 높게 부여하고 있다. 당국은 내심 현 가산금리를 낮출 여지가 있지 않느냐는 입장이다. 하지만 B은행 관계자는 “지난해 초에 이미 연체가산금리를 2%포인트 낮췄다”며 “연체금리가 과도한지에 대해서도 원가분석 차원에서 좀 더 따져봐야 한다”고 말했다.', '원리금 연체시 대출의 상환순서를 바꾸는 방안도 이견이 적지 않다. 현재는 대출상환시 저당권 등 비용→이자→원금 순으로 갚게 되는데 앞으로는 이자보다 원금부터 갚게 하는 방안이다. 모수인 원금자체를 빨리 줄여 이자부담을 덜어주자는 게 당국의 포석이다. C은행 관계자는 “(당국의 방안은) 대출자의 도덕적 해이를 유발하고 이럴 경우 은행 창구에선 대출심사가 까다로워져 취약계층 대출이 오히려 어려워질 수 있다”고 강조했다.', '당국과 은행권이 이견차를 좁히지 못하면서 한계·취약계층 대출자들에 대한 대책은 물거품이 될 공산이 크다는 우려가 나온다.  이에 따라 5일로 예정된 금융당국의 황교안 국무총리 권한대행에 대한 신년 업무보고에선 구체적인 한계차주의 연체부담 방안 등 취약계층 가계대출 완화방안은 빠지는 것으로 알려졌다.', '고동원 성균관대 법학전문대학원 교수는 “가계부채 연착륙 방안은 은행 입장에서도 필요한 만큼 전향적으로 생각해야 한다”며 “법적인 논란 부분은 민법의 일반원칙에 예외적으로 특별법인 금융소비자기본법 등에 담아 입법적으로 해결할 수 있는 문제”라고 말했다.', '은행에 일종의 ‘당근’을 제시하는 등 유인책을 마련해야 한다는 의견도 있다. 이민환 인하대 글로벌금융학과 교수는 “(금융당국의 입장을 그대로 반영하게 되면) 건전성 규제의 틀을 그대로 둔 채 그로 인한 비용에 대해서만 은행에 책임을 맡기는 겪이 될 수 있다”며 “은행의 건전성규제를 조금 완화해주거나 가계대출 쪽에서 숨통을 틔워 주는 등 인센티브도 같이 제시해야 한다”고 지적했다.', '노희준 (gurazip@edaily.co.kr)', '\n\t', '\n\t']"
연합뉴스,['2017.01.01. 오후 1:37'],"['\n\t', '\n\t', '\n\n', '\n', '\n\t\n\t', '(서울=연합뉴스) 2017 정유년의 희망찬 새해가 밝았습니다. 하나 가족 모두에게 건강과 행복이 가득한 한 해가 되기를 기원합니다. ', '    작년 하나금융그룹은 많은 것들을 이뤘습니다. 통합은행 출범 후 9개월만인 2016년 6월 은행 전산 통합을 성공적으로 마무리했고, 11월에는 하나금융투자의 차세대 시스템을 오픈했습니다. 아울러 은행 및 카드사의 노조 통합으로 조직이 더욱 견고해졌습니다. ', '    그러나 현재 우리를 둘러싸고 있는 국내 외 정치, 경제 상황은 여리박빙(如履薄氷)과 같이 매우 불안한 상황입니다. 작년부터 시작된 정국 불안, 기업구조조정 문제, 부동산 시장의 정체, 1천300조원에 달하는 과도한 가계부채와 금리 인상에 따른 이자 부담 가중 등으로 투자와 소비가 위축돼 국내 외 주요 기관들은 3년 연속 2%대의 저성장 국면을 예상합니다. ', ""    친애하는 하나 가족 여러분, 핀테크의 무한 경쟁은 이제 본격적으로 진행된다고 볼 수 있습니다. 올해 인터넷 전문은행이 출범해 본격적으로 마케팅을 시작하고, 금융권, 유통사, 통신사 등에서 20개가 넘는 페이서비스가 출시돼 치열하게 경쟁하고 있습니다. 승자는 손님이 직접 네트워크를 형성해 나가는 '오가닉 비즈니스' 기업이 될 것입니다. 오가닉 비즈니스란 유통자가 아닌 손님이 직접 네트워크를 만들고, 이 네트워크가 마치 생명체처럼 성장하고 진화하는 비즈니스를 말합니다. "", ""    800만 회원을 향해 가는 하나멤버스도 이제는 손님이 스스로 홍보할 수 있도록 손님의 목소리에 귀를 기울이고 서비스를 개선해 나가야 합니다. 이런 그로스해킹 방식을 통해 하나멤버스도 플랫폼 경쟁을 뛰어넘어 '오가닉 비즈니스'로 성장할 수 있을 것입니다. 올해는 하나멤버스를 해외 주요 국가들과 제휴 연계해 포인트 교환을 통한 글로벌 멤버십 네트워크를 구축할 겁니다. 제품과 서비스는 복제하기 쉬우나 네트워크 그 자체는 경쟁자가 따라올 수 없는 고유한 가치입니다. "", '    해현경장(解弦更張), 다시 줄을 고쳐 맬 때입니다. \'해현경장\'이란 중국 한나라 동중서(董仲舒)가 무제에게 올린 ""현량 대책""에서 유래된 것으로서 \'거문고의 줄을 다시 매다\'는 뜻입니다. 즉, 느슨해진 것을 긴장하도록 다시 고치거나 제도를 개혁하는 것을 비유하는 고사성어입니다. 이제 우리도 판(板)을 바꾸기 위해 기업문화와 영업방식에 있어 변화와 혁신이 필요합니다.', '    상품개발 통합 플랫폼 구축에 주력해 손님이 원하는 금융서비스를 적시에 제공할 수 있어야 합니다. 또 자발적으로 흥이 나서 영업을 할 수 있는 환경도 조성해야 합니다. 역지사지(易地思之)의 관점에서 힘든 점을 도와주고, 단점을 지적하기보다 장점을 더욱 칭찬해 신명나게 일할 수 있는 분위기를 만듭시다.', '    buff27@yna.co.kr', '\n\t', '\n\t']"
이데일리,"['A21면 1단', '2017.01.01. 오후 2:05', '2017.01.02. 오전 6:01']","['\n\t', '\n\t', '\n\n', '\n', '\n\t\n\t', '[이데일리 방성훈 기자] 지난해에 이어 올해에도 글로벌 인수·합병(M&A)시장이 활기를 띌 전망이다. 도널드 트럼프 미국 대통령 당선인이 친(親)기업정책을 예고하고 있는데다 기업들의 자금 조달 비용이 여전히 낮은 수준을 유지할 것으로 예상되기 때문이다.', '월스트리트저널(WSJ)은 31일(현지시간) 금융정보서비스업체 딜로직 데이터를 인용, 지난해 발표된 M&A 규모가 3조6700억달러(한화 약 4422조원)에 달한다고 밝혔다. 이는 지난 2015년 4조4000억달러(약 5302조원)에 비해서는 15% 적은 규모지만 2008년 글로벌 금융위기 이후로는 두 번째로 큰 규모다. 이 가운데 지난해 하반기에 발표된 굵직한 M&A 딜이 올해 줄줄이 현실화할 것으로 기대되고 있다. ', '실제 미국 2위 통신업체인 AT&T는 지난해 10월 말 미디어기업인 타임워너를 850억달러(102조원)에 인수하기로 합의했다. 바로 다음 날엔 영국 담배회사 브리티시아메리칸타바코(BAT)가 미국 2위의 담배회사 레이놀즈를 470억달러(57조원)에 사들이겠다고 발표했다. 또 일주일도 지나지 않아 미국 스마트폰용 반도체업체 퀄컴이 네덜란드 통신·차량용 반도체회사 NXP를 390억달러(47조원)에 사들이겠다고 밝혔고 지난달 20일에는 세계 3위 특수가스 생선업체 미국 프락스에어와 독일 산업용 가스 생산업체 린데가 M&A에 잠정 합의했다. 합병규모는 670억달러(81조원)에 달한다. ', '전문가들은 트럼프 당선인의 한시적 세금감면(tax holiday) 정책이 미국을 중심으로 글로벌 M&A시장을 활성화시켜 줄 것이라고 기대하고 있다. 딜로직에 따르면 비슷한 정책이 적용됐던 지난 2005년에도 미국 기업들의 M&A 거래규모가 전년대비 34% 증가한 바 있다. ', '뉴욕 투자은행 페렐라 와인버그 파트너스의 공동 창업자 피터 와인버그는 “(최근처럼) M&A를 활성화시킬 수 있는 요소들이 모여 있는 것을 본 적이 없다”면서 “낮은 금리와 CEO들의 신뢰 증대, 조세제도 변화가 새해 M&A 거래를 기록적인 영역으로 끌어 올릴 것”이라고 내다봤다. JP모건체이스 커트 사이먼 글로벌 M&A부문 대표도 “세금감면정책이 M&A를 자극시킬 것이라는 덴 의심의 여지가 없다”고 강조했다. ', '다만 트럼프 당선인이 미국내 일자리 창출을 강조하고 있는 만큼 해외로 돈이 새어 나가는 것을 막기 위해 버락 오바마 행정부와 같은 입장을 고수할 것이라는 관측이 제기된다. 15년만에 가장 큰 거래로 주목을 받았던 화이자-앨러건의 M&A는 화이자가 앨러건 인수 후 본사를 아일랜드로 옮겨 세금을 줄이려다가 지난해 4월 오바마 행정부가 조세회피규제를 강화하면서 무산됐다. 또 연방준비제도(Fed)가 예상보다 서둘러 기준금리를 올릴 경우 기업 조달비용이 늘어나 투자를 위축시킬 수 있다. 이외에도 트럼프 당선인과 대립각을 세우고 있는 중국이 해외투자에 대해 엄격한 잣대를 들이댈 것이라는 점은 M&A시장에 변수로 작용할 전망이다.', '방성훈 (bang@edaily.co.kr)', '\n\t', '\n\t']"
이데일리,"['A25면 1단', '2017.01.01. 오전 10:29', '2017.01.02. 오전 6:01']","['\n\t', '\n\t', '\n\n', '\n', '\n\t\n\t[이데일리 이성재 산업부장] 2017년 정유년 새해가 밝았다. 혼돈과 좌절이 가득했던 병신년을 뒤로한 채 새날이 열렸다. 새해에는 국민의 절망과 분노가 담긴 지난해 촛불의 열기가 무색하지 않을, 정치와 기업이 바로 서는 대한민국을 갈망해본다. ', '하지만 걱정부터 앞선다. 기업들은 올해 역시 생존을 위해 처절하게 몸부림을 쳐야 할 한 해가 될 것이라고 말한다. 탄핵과 특검, 조기대선 등 복잡한 정국 탓에 미래에 대한 불안감이 커진 것이 가장 큰 이유다. 여기에다가 정부는 2017년 경제성장률 전망치를 2.6%로 하향 조정했다. 미국의 금리인상, 트럼프대통령 당선 이후 통상정책 불확실성의 증대, 유가 상승 등 대외적인 악재를 반영한 전망치다. ', '2%대의 경제성장률은 1997년 외환위기 이후 20여년 만에 처음이다. 저성장 늪에 빠진 경제에 세계시장의 불확실성이 덮치자 사실상 ‘경제위기선언’을 한 셈이다. 그럼에도 일각에서는 현재의 시한부 정부에서는 2%대의 경제성장률조차 유지하기 힘들 거라고 말한다. ', '하지만 정작 기업의 어려움은 다른 데 있다. 경제위기가 커질수록 강도를 더해가는 정치권의 기업 공세다. 최근 한국경제연구원이 조사한 ‘대한민국 기업·경제에 대한 국민인식’에 따르면 기업경영의 가장 큰 걸림돌로 국민 2명 중 1명은 ‘정치권의 간섭’을 꼽았다. 이어 ‘강한 노조활동’과 ‘과도한 정부규제’도 기업 경영활동의 발목을 잡는다고 지적했다. ', '사실 정치권이 기업의 성장을 가로막은 것은 어제오늘의 일이 아니었다. 하지만 이번은 상황이 다르다. 중국이 글로벌기업 인수·합병을 주도하면서 영토를 넓혀가고 있고 미국은 트럼프행정부 출범 이후 보호무역주의를 한층 강화할 것으로 예상되면서 수출 중심인 한국은 이미 치명타를 맞은 셈이다. ', '국제 전문가들은 “2008년 글로벌 금융위기 이후 세계경제의 회복이 늦어지고 있다”며 “이에 따라 자국의 이익을 최우선으로 하려는 미국·중국 등의 보호무역주의 강화가 당분간 지속될 것”이라고 전망했다. ', '문제는 이 같은 흐름이 쉽게 바뀌지 않을 것이라는 데 있다. 사정이 이런데도 정부와 정치권은 투자를 가로막는 각종 규제법안만 쏟아내고 있다. 정작 경제활성화를 위한 서비스산업발전법, 규제프리존법 등의 법안은 국회 의원들의 책상 위에서 먼지만 뒤집어쓰고 있다. ', '절망적이다. 기업들은 글로벌 무대에서 경쟁자와 생사를 건 사투를 벌이고 있지만 진짜 적은 늘 가까이서 비수를 겨누고 있다. 이러니 어떤 기업이 적극 투자에 나설 수 있겠는가. 이미 국내 정치불안 등으로 잔뜩 움츠러든 기업은 올해 국제무대에서 입을 타격을 염려해 투자를 확대하는 대신 허리띠를 더욱 졸라맬 것이다. ', '새해 정부와 정치권이 할 일은 과감한 규제개혁과 조속한 경제활성화 법안처리를 통해 기업이 마음 놓고 투자를 하고 일자리를 늘릴 수 있도록 돕는 일이다. 기업의 경영활동을 저해하는 크고 작은 규제를 과감히 철폐하는 일도 시급하다. 특히 최순실게이트로 한치 앞을 내다볼 수 없는 기업의 ‘시계제로’를 해결해야 한다. 특검수사를 조속히 마무리해 기업이 숨통을 틔우게 해주는 것이다. ', '정부와 정치권이 아무리 좋은 경제활성화 대책을 내놓아도 기업이 나서지 않으면 말짱 헛일이다. 정치논리와 규제로 꽁꽁 묶어만 두다가 기업이 정작 나서야 할 ‘골든타임’을 놓친다면 한국경제는 더 이상 희망이 없다. 기업도 살아 움직이는 생물이다. 키우고 지키려면 영양분을 공급하고 햇볕도 비춰주는 따뜻한 보살핌이 필요하다. ‘기본 중의 기본’이다. 정유년 새해 대한민국이 바로서는 나라가 되길 기원해본다.', '이성재 (shower@edaily.co.kr)', '\n\t', '\n\t']"
이데일리,['2017.01.01. 오전 11:38'],"['\n\t', '\n\t', '\n\n', '\n', '\n\t\n\t[이데일리 김경은 기자]올해 달라지는 금융제도 최대 이슈 중 하나는 24시간 365일 은행 업무를 볼 수 있는 인터넷 전문은행의 출범이다. ', '1일 금융권에 따르면 지난달 금융위원회로부터 본인가를 받은 K뱅크는 이달 말∼2월 초 정식으로 문을 열 계획이다. K뱅크와 함께 인터넷은행 예비인가를 받은 카카오뱅크도 이달 초 금융위에 본인가를 신청하고 상반기 중 오픈한다.', '인터넷 은행은 24시간 365일 핸드폰으로 결제·송금, 예금가입, 대출, 온라인 자산관리 등 주요 은행 서비스 이용이 가능하다. 나아가 기존 은행들과 달리 오프라인 유지 비용이 적어 금리 경쟁력이 높다는 점에서 위협적이다. 금융회사가 아닌 정보기술(IT) 회사가 소유하고 있다는 점도 차별화된 포인트다. IT회사가 보유한 컨텐츠나 서비스와 결합한 새로운 금융 서비스의 탄생도 기대되는 대목이다.   ', '또 은행법 개정안이 통과되지 않을 경우 자기자본확충이 어려워 반쪽자리 출범이 불가피하다는 점도 문제다. 현재 인터넷은행 출범과 관련해 은행법 개정안 2건과 특례법 2건이 상정돼 있는 상태다. 특례법을 통해 인터넷은행에 한해 은산분리완화가 가능하지만 은행법 개정이 되지 않을 경우 자본확충을 위한 증자는 어려워진다. ', '임종룡 금융위원장은 “법적 뒷받침이 하루라도 빨리 정비되는 것이 인터넷 전문은행 성공의 핵심 관건”이라고 강조하며 국회의 개정법안 처리를 촉구했다.', '김경은 (ocami81@edaily.co.kr)', '\n\t', '\n\t']"
이데일리,"['2017.01.01. 오후 2:20', '2017.01.01. 오후 2:40']","['\n\t', '\n\t', '\n\n', '\n', '\n\t\n\t', '[이데일리 원다연 기자] 강호인 국토교통부 장관은 주택시장 안정화를 위해 시스템을 구축하는 등 선제적 대응에 나서겠다고 1일 밝혔다. ', '강호인 장관은 이날 신년사를 통해 “경제 성장률이 둔화되고 미국 금리 인상, 북한 변수 등의 불확실성이 커지고 있다”며 “위기 요인들을 철저하게 관리해 경제 살리기에 총력을 기울여야 한다”고 강조했다. ', '강 장관은 이를 위해 “공급 과잉 등에 따른 주택시장의 경착륙 가능성, 건설시장 수주 감소에 의한 침체 우려 등에 선제적으로 대응해 경제의 활력을 잃지 않도록 해야 한다”며 “주택시장에 대한 모니터링을 강화하고 상황별 대응 수단을 마련하는 등 시장 안정 시스템을 구축해야 한다”고 강조했다. ', '아울러 강 장관은 “건설·물류 등 전통 산업의 고부가가치화를 통해 경쟁력을 확보하고 첨단기술과 융합해 새로운 성장 동력으로 거듭날 수 있도록 해야 한다”고 말했다. ', '구체적으로 “드론과 자율주행차, 스마트시티 등 신산업에 대한 연구·개발과 시범사업, 규제 완화와 같은 지원 대책들은 미래에 대한 비전과 전략 속에 추진돼야 효과를 낼 수 있다”며 종합적이고 구체적인 추진 전략 수립에 나설 것을 강조했다. ', '강 장관은 안전에 대해서도 당부했다. 강 장관은 “국토교통부의 모든 업무가 국민의 안전과 직결돼있는 만큼 안전이 업무의 시작과 마지막이라는 생각으로 정책을 추진해 달라”고 말했다.', '원다연 (here@edaily.co.kr)', '\n\t', '\n\t']"
