media,time,body이데일리,['2017.01.01. 오전 6:01'],"['\n\t', '\n\t', '\n\n', '\n', '\n\t\n\t[이데일리 노희준 기자] 국내외 불확실성이 고조되는 상황에서 맞게 된 2017년 정유년(丁酉年) 새해에 금융당국 수장들은 1일 너나할 것이 위험(리스크)관리를 최우선 과제로 꼽는 데 주정하지 않았다. ', '임종룡 금융위원장은 신년사를 통해 “작은 위험요인 하나가 큰 위기로 이어질 수 있다는 최고의 긴장감을 가지고 지금의 상황에 슬기롭게 대처해야 할 때”라며 ”올해 한해 금융정책의 첫 번째 중점과제로 ‘철저하고 치밀한 위험관리“라고 말했다.  ', '진웅섭 금감원장도 신년사에서 ”금융시장을 안정화할 수 있도록 전방위 노력을 강화해야 한다“며 ”올 해는 여느 해보다 우리 경제와 금융시장의 안정을 크게 위협할 만한 수많은 불안요인들이 산재해 있다“고 강조했다.', '이런 측면에서 두 수장이 강조한 사안은 구조적 불안요인인 가계부채와 기업구조조정 문제다. ', '임 위원장은 가계부채와 관련 ”상환능력 내에서 빌리고 처음부터 나눠 갚는 선진형 여신 관행을 가계부채 전영역에 안착시키고 고정금리, 분할상환 목표 비율을 당초 계획보다 높이겠다“고 설명했다. ', '진 원장도 ”금리인상 등 불안요인에 대비해 가계부채 연착륙 유도와 금융회사의 건전성 확보에 힘써야 한다“고 역설했다. ', '기업 구조조정을 두고 임 위원장은 ”기업구조조정은 회생법원 출범을 계기로 법원과 협력을 강화하고 민간 구조조정전문회사를 활성화하는 등 새로운 기업구조조정의 틀을 확립하겠다”고 언급했다. ', '진 원장도 “경제의 불확실성이 커질수록 신속하고 엄격한 구조조정을 통해 기업부실 확산을 방지하는 것 또한 중요하다”며 “은행이 기업구조조정에 대비해 충분한 기초체력을 확보할 수 있도록 신용평가와 대손충당금 적립 상황을 면밀히 살펴야 할 것”이라고 힘줘 말했다.', '노희준 (gurazip@edaily.co.kr)', '\n\t', '\n\t']"
연합뉴스,"['2017.01.01. 오전 6:10', '2017.01.01. 오전 7:54']","['\n\t', '\n\t', '\n\n', '\n', '\n\t\n\t', '이달 말 문 여는 K뱅크 ""내 손안의 첫 은행""…카카오뱅크도 상반기 오픈 ', '(서울=연합뉴스) 박의래 기자 = 올해 은행권 최대 이슈 중 하나는 인터넷 전문은행의 출범이다. ', '    1일 금융권에 따르면 지난달 금융위원회로부터 본인가를 받은 K뱅크는 이달 말∼2월 초 정식으로 문을 열 계획이다.', '    K뱅크와 함께 인터넷은행 예비인가를 받은 카카오뱅크도 이달 초 금융위에 본인가를 신청하고 상반기 중 오픈한다.', '    심성훈 K뱅크 초대 은행장은 지난달 금융위의 본인가를 받은 자리에서 ""K뱅크는 24시간 365일 언제든지 이용할 수 있는 은행이 될 것""이라며 ""내 손안의 첫 번째 은행을 만들겠다""고 말했다.', '    시중 은행들이 인터넷은행을 경계하는 가장 큰 이유는 인터넷은행의 조직이 매우 효율적이라는 점이다.', '    인터넷은행은 기존 은행과 달리 지점이 없고 모든 업무를 인터넷과 모바일, 현금자동입출금기(ATM) 등 자동화기기로 처리한다.', '    지점과 창구 직원이 없어 인건비나 부동산 비용이 기존 은행과 비교해 획기적으로 적다. ', '    예를들어 K뱅크의 직원은 총 200여 명이지만 기존 은행들은 직원 수만 1만명이 넘는다.', '    이렇게 절감되는 비용으로 예금 이자를 더 주고 대출 금리는 낮춰 경쟁력을 유지한다는 계획이다. ', '    심 행장은 ""업계 최저 수준의 대출 금리와 최고 수준의 수신금리 제공으로 고객에게 환원하겠다""고 밝혔다.', '    인터넷은행과 시중 은행의 또 다른 차이는 금융회사가 아닌 정보기술(IT) 회사가 중심이 돼 은행을 이끈다는 점이다.', '    KT와 카카오의 IT 기술을 활용해 이전과 다른 금융 서비스를 제공하겠다는 것이 두 은행의 목표다.', '    예컨대 K뱅크는 계좌개설이나 대출 등 은행업무가 24시간 365일 가능하다. ', '    스마트폰만 있으면 10분 안에 계좌를 개설하고, 소액 간편 대출을 활용하면 클릭 한 번으로 대출받을 수 있다.', '    또 각종 주주사에서 얻은 빅데이터를 기반으로 차별화된 신용평가를 통해 연 7~8% 정도의 중금리 대출 서비스를 제공할 계획이다.', ""    카카오뱅크는 '국민 메신저'로 불리는 카카오톡이 강점이다. "", '    이런 카카오톡을 영업채널로 활용해 접근성을 높이고, 각종 서비스를 제공한다는 계획이다.', '    K뱅크는 주주사인 GS리테일의 1만500개 GS25 편의점을 오프라인 영업점으로 활용할 수 있다는 것이 강점이다.', '    K뱅크는 GS25 편의점에 이미 설치된 현금지급기(CD)나 현금자동입출금기(ATM)를 우선 활용하기로 했다. ', ""    또 ATM에서 계좌를 개설하고 즉석에서 체크카드도 발급받을 수 있는 '스마트 ATM'을 개발해 주요 거점 편의점에 설치해 운영할 계획이다."", '    두 은행 모두 다양한 디지털 콘텐츠를 보유하고 있다는 점도 다른 은행과의 차별점이다.', '    현금 이자뿐 아니라 음원이나 통신 데이터 등 스마트폰에서 이용 수요가 많은 디지털 콘텐츠를 이자 형태로 제공한다는 전략이다. ', '    중장기적으로는 카드 망 대신 은행 망을 이용하는 직불방식의 간편결제 서비스를 출시해 0%대의 수수료로 결제 서비스를 제공할 계획이다.', '    또 모바일 기반의 주택담보대출이나 로보 어드바이저를 통한 맞춤형 자산관리 서비스, 해외 통신사 제휴를 통한 전화번호 기반 해외 송금 서비스 등도 출시할 방침이다.', '    금융권 관계자는 ""인터넷은행은 출범 전부터 시중 은행들의 변화를 끌어내는 등 메기 효과를 톡톡히 일으키고 있다""며 ""본격적인 영업을 시작하면 얼마나 새로운 서비스로 은행 산업을 바꿔 놓을지 기대된다""고 말했다.', '    laecorp@yna.co.kr', '\n\t', '\n\t']"
연합뉴스,"['2017.01.01. 오전 6:09', '2017.01.01. 오전 8:04']","['\n\t', '\n\t', '\n\n', '\n', '\n\t\n\t', '""트럼프 취임 후 환율 안정화 될 것""', '(서울=연합뉴스) 송광호, 고동욱, 박의래 기자 = 원/달러 환율이 최근 급격히 오르면서 중소기업 수입업체나 유학생 자녀를 둔 부모는 물론 해외 직구족들까지 환율 움직임에 신경을 곤두세우고 있다.', '    그러나 전문가들은 지금의 환율 상황에 일희일비하면서 서둘러 대응하기보다는 일종의 원칙을 세워놓고 차분히 대응해야 한다고 강조한다. ', '    환율이 급격하게 오른 만큼 조만간 조정받을 수 있어서다. ', '    또 큰돈을 만지는 수출입업체는 반드시 헤지(hedge)를 하고 사업계획에 따라 정해진 원칙대로 움직일 것을 조언했다.', '◇ ""불확실성 때문에 달러화 강세…트럼프 취임 후 안정될 것""', '    최근 원/달러 환율이 크게 오른 것은 미국 연방준비제도(Fed·연준)가 지난해 12월 기준금리를 올리고, 올해 추가로 3번의 금리를 올릴 것을 시사했기 때문이다. ', '    또 트럼프 정부의 재정적자 확대 방안도 환율 상승을 이끌고 있다.', '    일각에서는 내년에는 원/달러 환율이 1,300원까지 오를 것이라는 전망도 하고 있다.', '    그러나 많은 전문가는 지금의 달러 강세 현상이 계속되긴 힘들 것으로 보고 있다. ', '    특히 트럼프 차기 미국 행정부의 경제정책의 윤곽이 드러나면 불확실성이 사라져 점차 달러화 강세가 누그러질 것이란 전망이다.', '    김탁규 IBK기업은행 반포자이WM센터 PB팀장은 ""트럼프가 취임하고 정책이 가시화되는 등 불확실성이 걷히고 나면 심리적인 압박들도 많이 해소되고 원/달러 환율도 안정을 찾을 것""이라며 ""원/달러 환율이 더 오를 여유는 그리 많아 보이지 않아 보인다""고 말했다.', '    조현수 우리은행 WM자문센터 자산관리컨설팅 팀장도 ""달러 강세가 계속되면 자국 수출 기업들이 어려워지기 때문에 이 같은 달러 강세 현상이 지속하긴 어려울 것""이라며 ""늦어도 하반기에는 지금 같은 달러 강세가 진정될 것으로 보여 대규모 환전은 뒤로 미루는 것이 좋다""고 말했다.', '    민경원 NH선물 연구원은 ""외환시장에서는 현재 달러 강세 기조가 과도하다는 인식이 적지 않다""며 ""내년에는 원/달러 환율의 상승세가 조정 국면을 맞을 것으로 본다""고 말했다.', '◇ 수출입업체 반드시 헤지하고 유학생 부모는 분할 환전추천', '    환율에 관심이 많은 곳은 달러화를 가장 많이 만지는 수출입업체들이다. 장사를 잘해도 환차손을 보면 수익이 많이 줄어들 수 있어서다.', '    그러나 전문가들은 환율 시황에 너무 집중하기보다는 미리 주거래 은행과의 상담을 통해 헤지 계획을 잘 세우는 것이 가장 중요하다고 말한다.', '    상태현 우리은행 트레이딩부 부부장은 ""수출입업체는 올해 사업계획을 짠 내용을 바탕으로 주거래 은행과 개별 상담을 받고 헤지 계획을 세워야 한다""고 말했다.', '    그는 ""다른 상품보다 선물환 계약을 통한 기본적인 헤지가 제일 좋다""며 ""환차익을 노리기보다는 손해 보지 않겠다는 마음으로 헤지 계획을 세우고, 계획을 세우면 환율 변동에 너무 신경 쓰기 보다는 정해진 원칙에 따라 움직여야 한다""고 말했다.', '    유학생 부모라면 급하게 환전하기보다는 시간을 두고 분할 환전할 것을 추천했다. ', '    신동일 KB국민은행 도곡스타PB센터 부센터장은 ""환율을 자주 체크하면서 목표가가 왔을 때마다 조금씩 분할 매수하는 게 가장 좋다""며 ""당분간 달러의 지위가 확고할 것으로 보여 지금부터 천천히 매수하는 것도 나쁘지 않아 보인다""고 조언했다.', '    당장 급하게 송금해야 하는 부모라면 은행들의 다양한 환전 상품을 꼼꼼히 살펴보는 것이 조금이라도 환전 비용을 아끼는 방법이다.', '    최근에는 은행들이 내놓는 애플리케이션(앱)을 통해 환전하면 환전 수수료를 최고 90%까지 절약할 수 있다.', '    또 겨울 방학 등 환전 성수기를 맞아 주거래 은행에서 내놓는 각종 환전 이벤트를 활용하는 것도 좋다.', '    올해 환율 변동성이 클 것으로 보여 환차익을 노리려는 투자자라면 달러화 예금이나 주가연계증권(ELS) 상품을 살펴보면 좋다.', '    달러화 예금은 목표 가격을 정해놓고 달러가 쌀 때마다 분할 매수해 6개월∼1년 단위의 정기 예금에 가입하면 원금을 지키면서도 연 1% 정도의 이자 수익을 올릴 수 있다.', '    신 부센터장은 ""원금 손실 가능성을 감수한다면 달러 ELS(주가연계증권) 상품도 괜찮다""며 ""원금 손실이 발생할 수 있는 조건을 잘 살펴본 뒤 투자하면 달러가 오를 때 환차익까지 볼 수 있어 연 6% 정도 수익을 낼 수 있다""고 말했다. ', '    해외 쇼핑을 즐기는 직구족이라면 반드시 달러로 결제하고, 상황에 맞게 신용카드와 체크카드를 적절히 활용하면 좋다.', '    신용카드는 카드대금 결제일을 기준으로 환율이 확정되고, 체크카드는 상품 구매 당일의 환율을 적용받는다.', '    원/달러 환율이 떨어지는 추세라면 신용카드를, 오르는 추세라면 체크카드를 사용하면 조금이라도 환율 피해를 줄일 수 있다.', '    laecorp@yna.co.kr', '\n\t', '\n\t']"
연합뉴스,['2017.01.01. 오전 7:03'],"['\n\t', '\n\t', '\n\n', '\n', '\n\t\n\t', ""소득 대비 대출 비율 급등…젊은층, 주택자금 마련에 '허덕'"", '(서울=연합뉴스) 노재현 기자 = 30대 젊은층과 자영업자의 한숨이 깊어졌다.', ""    수입이 사실상 제자리걸음을 하고 있지만 갚아야 할 부채는 갈수록 불어나는 '진퇴양난'의 모습이다."", '    1일 한국은행에 따르면 최근 소득대비 가계대출 비율(LTI·Loan To Income ratio)을 차주의 연령대별로 살펴보면 30대 이하의 상승세가 두드러졌다.', '    한은이 신용조회회사인 나이스신용평가로부터 입수한 약 100만명의 가계부채 데이터베이스(DB)를 바탕으로 추산한 결과다. ', '    나이가 30대 이하인 차주의 LTI는 작년 9월 말 현재 179.5%로 2015년 말(164.1%)보다 15.4% 포인트(p) 올랐다.', '    은행 등 금융기관에서 빌린 대출 규모가 한 해 벌어들이는 소득의 1.8배에 육박할 정도로 커진 것이다.', '    같은 기간 40대 차주의 LTI(198.4%)는 13.9%p 올랐고 50대(204.5%)는 6.3%p, 60대 이상(248.6%)은 7.3%p 상승했다.', '    아직 30대 이하 차주의 LTI가 가장 낮은 수준이지만 오름폭은 50대나 60대 이상 등 다른 연령층보다 훨씬 가파르다.', '    이에 대해 한은은 지난달 금융안정보고서에서 ""30대 차주의 경우 전세의 매매 전환, 전세자금 마련 등으로 주택담보대출 수요가 크게 늘어난 데 기인한 것으로 추정된다""고 설명했다.', '    한은이 가계부채 데이터베이스(DB)를 분석한 결과, 작년 9월 말 현재 30대 차주의 경우 가계대출 잔액의 43.7%가 주택매입이나 전세자금 마련 용도인 것으로 파악됐다.', '    30대를 제외한 다른 연령대의 주택 관련 대출 비중(33.4%)보다 훨씬 높다.', '    2014년 하반기 이후 정부의 부동산 규제정책 완화와 기준금리 인하 등으로 수도권을 중심으로 전셋값과 주택가격이 크게 올랐다.', ""    '사회 초년생'인 30대부터 치솟은 주거비를 감당하느라 빚을 많이 내는 현실이다.   "", '    반면, 경기 부진 등의 여파로 소득 증가세는 주춤한 추세다. ', ""    통계청 등의 '2016년 가계금융·복지조사 결과'에 따르면 가구주가 30∼39세인 가구의 2015년 평균 소득은 5천148만원으로 1년 전보다 1.4%(73만원) 늘어나는 데 그쳤다."", '자영업자의 상황도 비슷하다. ', '    작년 9월 말 현재 자영업자의 LTI는 345.8%로 2015년 말(328.2%)과 비교하면 9개월 사이 17.6%p 급등했다.', '    상승 폭이 같은 기간 상용근로자 등 비자영업자 11.2%p(179.4%→190.6%)보다 훨씬 가파르다.', '    한은에 따르면 자영업자의 대출액은 작년 9월 말 현재 464조5천억원(차주 수 141만명)으로 집계됐다.', '    최근 은퇴한 고령층과 마땅한 직장을 구하지 못한 젊은층이 부동산임대업, 음식·숙박업 등 개인사업에 많이 뛰어들고 있다.', '    그러나 내수 부진 등으로 지갑이 얇아진 자영업자들이 늘고 있는 것으로 보인다.', '    가계금융·복지조사 결과를 봐도 2015년 자영업자 가구의 평균 소득 증가율은 1.2%로, 임시·일용근로자(5.8%)나 상용근로자(2.1%)보다 낮았다.', '    한은은 금융안정보고서에서 ""자영업자들은 임금근로자에 비해 소득이 경기 변동에 민감한 데다 창·폐업도 빈번해 안정적 부채상환에 어려움을 겪을 수 있다""고 우려했다.', '    nojae@yna.co.kr', '\n\t', '\n\t']"
연합뉴스,['2017.01.01. 오전 8:00'],"['\n\t', '\n\t', '\n\n', '\n', '\n\t\n\t', ""(서울=연합뉴스) 고동욱 기자 = IBK기업은행은 2일부터 2월 말까지 IBK평생한가족통장 적립식 상품에 가입하는 2017명에게 5천원 상당의 모바일 상품권을 주는 '꼬끼오~ 닭의 해에 적금은 꼭이오!' 이벤트를 진행한다고 1일 밝혔다."", '    기업은행은 적금에 30만원 이상 새로 가입하고 자동이체를 등록한 고객에게 8주간 매주 선착순으로 모바일 상품권을 준다.', ""    기업은행은 또 2일부터 우대금리를 포함해 최고 연 2.07%의 금리를 제공하는 거치식 상품인 '2017 패키지예금'을 총 3조원 규모로 판매한다."", 'sncwook@yna.co.kr', '\n\t', '\n\t']"
이데일리,['2017.01.01. 오전 8:01'],"['\n\t', '\n\t', '\n\n', '\n', '\n\t\n\t', '[이데일리 김경은 기자] IBK기업은행은 새해를 맞아 오는 2일부터 2월말까지 영업점 창구 또는 비대면채널을 통해 IBK평생한가족통장 적립식 상품에 가입한 2017명에게 5000원 상당의 모바일상품권을 증정하는 ‘꼬끼오~ 닭의 해에 적금은 꼭이오!’ 이벤트를 진행한다고 1일 밝혔다.', '적금을 30만원 이상 신규하고 자동이체를 등록한 고객을 대상으로 8주간 매주 선착순 250명에게 5000원 상당의 파리바게뜨 또는 스타벅스 모바일상품권을 제공한다. ', '또 이벤트 대상 중 닭의 해에 태어나거나 계좌통합관리서비스(www.accountinfo.or.kr)로 타행에서 IBK로 잔고이전을 완료한 고객에게는 추첨을 통해 30만원권 기프트카드(10명)와 정관장 홍삼농축액(10명)을 증정한다.', '아울러 기업은행은 오는 2일부터 우대금리 포함 최대 연 2.07%의 금리(1월1일 기준)를 제공하는 거치식 상품인 ‘2017 패키지예금’을 총 3조원 규모로 2월말까지 판매한다.', '상품은 정기예금(3개월~1년)과 중소기업금융채권(1년)으로 구성되었으며, 급여이체, 아파트관리비 이체, 상품 추가가입 등 일정 조건 충족시 최고 연 0.15%포인트의 우대금리를 제공한다.', '1년만기 중소기업금융채권의 경우 기본금리 연 1.87%(1월1일 기준)에 우대금리 0.15%p를 더해 최대 연 2.02%의 금리가 적용되며, 신규고객의 경우에는 우대금리 0.05%p가 추가돼 최대 연 2.07%의 금리를 받을 수 있다.', '김경은 (ocami81@edaily.co.kr)', '\n\t', '\n\t']"
이데일리,['2017.01.01. 오전 9:10'],"['\n\t', '\n\t', '\n\n', '\n', '\n\t\n\t', '[이데일리 이명철 기자] 정유년 국내 증시는 박스권을 뚫을 수 있을까. 2017년 초 도널드 트럼프의 미국 대통령 당선 이후 시행될 재정정책 확대는 글로벌 공조로 이어져 위험자산 투자에 유리한 환경을 조성할 것으로 기대된다. 국내 증시 역시 상장사들의 실적 개선을 모멘텀 삼아 반등 모색에 나선다. 다만 미국의 보호무역주의와 기준금리 인상속도, 신흥국 불확실성 등은 리스크로 작용할 전망이다.', '글로벌 금융시장은 트럼프의 미국 대통령 취임 이후 진행될 트럼프노믹스에 주목하고 있다. 미국은 2017년 경제성장률이 2%를 훌쩍 넘으면서 지속 가능한 경기확장 국면에 진입할 전망이다. 트럼프 정부의 확대 재정정책과 연방준비제도(Fed·연준)의 고압경제 유도는 임금·인플레이션 상승압력을 크게 높이는 요인이다.', '트럼프 집권 기간에 시행될 미국 재정정책 확대와 보호무역 조합은 다른 국가들의 내수진작을 유도해 글로벌 재정정책 공조가 이뤄질 것이라는 분석이다. 박석현 유진투자증권 연구원은 “통화정책 효력은 한계를 노출하고 있고 선진국 대응은 점차 재정 정책으로 교체될 것”이라며 “한국을 포함한 신흥국 경제도 변동성에 대비하기 위한 재정지출이 적절한 대책이 될 수 있다”고 평가했다. 한국 경제도 완만한 수출 개선에 따른 자기자본이익률(ROE) 회복 사이클이 가시화된다면 증시 밸류에이션 재평가가 가능할 것으로 기대된다. 2016년 상장사 순이익은 지난 2010년(91조원)을 넘는 사상 최고치를 기록할 것으로 예상된다. 이미 3분기까지 누적 순이익은 84조원이다. 금융투자업계는 2017년 순이익 컨센서스가 100조원을 상회할 것으로 보고 있다.', '증권가에서도 수년째 지속되는 박스피 탈출을 내심 기대했다. 주요 증권사들이 제시한 2017년 코스피 예상 범위를 보면 최고 2200~2300선을 상단으로 제시했다. 예상 범위를 최대 2350까지 예상한 곽현수 신한금융투자 연구원은 “미국 기대 인플레 상승과 투자 증대는 한국 증시에 긍정적이고 부동산 규제에 자금이 주식으로 유입될 가능성이 높다”며 “코스피 상단은 보수적 수치일 뿐 중장기로 상단은 열어두고 대응할 필요가 있다”고 판단했다.', '다만 최저 1800선까지 코스피지수가 내려갈 수도 있다는 우려도 제기됐다. 김지형 한양증권 연구원은 “미국의 보호무역주의 강화에 따른 통상 마찰과 환율 부문 통화절상 압력이 높아질 수 있다”며 “유럽의 브렉시트(영국의 유럽연합 탈퇴) 협상과 주요국 선거, 금융권 부실자산 등 대외변수도 변동성 요인”이라고 지적했다.', '2017년에는 인플레이션 수혜 업종인 경기민감주와 업황 호조가 예상되는 정보기술(IT) 업종 등이 강세를 나타낼 것으로 예상됐다. 상품가격에 직접 영향을 받는데 경기민감주 특성상 원유·금속·곡물값이 오르는 최근 추세에 관심을 받는 양상이다. 인플레이션에 긍정적인 에너지, 소재, 산업재 등 시클리컬업종에 호재가 될 전망이다.', '영업이익 증가가 기대되는 IT업종도 주목할만한 대상이다. IT하드웨어·IT가전·디스플레이는 턴어라운드가 예상되고 소프트웨어는 이익 개선세가 지속된다는 평가다. 반도체의 경우 D램과 낸드(NAND) 가격 상승으로 실적 확대가 점쳐진다.', '증권사들의 최선호주 중 가장 많이 언급된 종목은 POSCO(005490)(포스코), 삼성전자(005930), SK하이닉스(000660) 롯데케미칼(011170), 삼성물산(028260), 현대중공업(009540) 등이다. 포스코는 미국 인프라 투자 확대의 수혜주로 분류되며 가장 높은 관심을 받을 것으로 예상됐다. 삼성전자의 경우 메모리 호황과 OLED의 성장, 지배구조 변화와 주주환원 상승에 대한 기대감이 높아질 것으로 예상된다. SK하이닉스도 마찬가지로 반도체 업황 호조를 향유할 SK하이닉스도 유망주로 기대를 받고 있다. 삼성물산 역시 삼성그룹 지배구조 개선의 수혜주로 분류됐다. 롯데케미칼은 부타디엔 체인 스프레드 확대에 따른 이익 성장이 전망되며 상장 조선사 중 재무상태가 가장 양호한 현대중공업도 기대주다.', '박소연 한국투자증권 연구원은 “대형 가치주의 투자 가치가 줄어들 경우에는 지배구조, 인프라, 사물인터넷(IoT) 등 가치 창출이 가능한 산업군이나 테마 등 선별 투자하는 것도 좋다”고 조언했다.', '이명철 (twomc@edaily.co.kr)', '\n\t', '\n\t']"
