media,time,body이데일리,"['2017.01.02. 오전 10:32', '2017.01.02. 오전 10:37']","['\n\t', '\n\t', '\n\n', '\n', '\n\t\n\t', '[이데일리 김기훈 기자] 박현주(', ') 미래에셋 회장은 2일 신년사를 통해 투자 없는 성장은 존재할 수 없다며 새로운 산업 성장에 맞춰 주식(Equity·에쿼티) 투자를 확대하고 연금사업에서의 높은 경쟁력을 유지하겠다고 밝혔다.', '박 회장은 “창업 때부터 단 한 번도 ‘투자’라는 미래에셋 비즈니스의 DNA를 잊은 적이 없다”며 “시대적 변화도 투자를 통한 모험정신과 야성의 부활을 요구하고 있다”고 말했다.', '그는 “부채 증가 사이클(Super Debt Cycle) 시대가 끝나고 가슴 뛰는 주식의 시대가 오고 있다”며 “미래에셋은 주식 투자를 통해 우리나라 새로운 산업에 씨를 뿌리고 장기적인 성장에 함께 해야 한다”고 강조했다.', '박 회장은 “한국 자본시장에서 최대 성장 비즈니스 중 하나인 연금사업은 아무리 강조해도 지나치지 않다”며 “상품과 컨설팅, 자산배분 등 연금 관련 전 부문에서 뛰어난 경쟁력을 유지해야 한다”고 언급했다.', '저금리와 수명 증가로 연금시장은 저축에서 투자로 바뀔 수밖에 없고 이에 따라 확정급여(DB)형에서 확정기여(DC)형이나 개인퇴직계좌(IRP) 중심으로 옮겨갈 것이 자명하다는 설명이다.', '그는 스티브 잡스의 스탠포드대 연설 말미에 있는 구절 ‘스테이 헝그리(Stay Hungry)을 인용하면서 “익숙한 것, 관행적인 것과 결별해야 한다”며 “열린 마음으로 미래를 향해 나아가는 영원한 혁신자(permanent innovator)가 돼야 한다”고 했다. 이어 “미래에셋은 언제나 투자를 통해 대한민국에 새로운 길을 만드는 기업이 돼야 한다”고 당부했다.', '아래는 박현주 회장의 신년사 전문이다.', '미래에셋 임직원 여러분! 도전의 2017년 새해가 밝았습니다. ', '미래에셋을 믿고 응원해 주시는 국내외 고객 여러분과 임직원 여러분께 새해 인사를 드립니다. 새해 복 많이 받으십시오.', '지난 2016년은 오늘의 시대가 정치·경제·사회 등 전 분야에 걸쳐 ‘거대한 전환의 시대, 불확실성의 시대’라는 사실을 웅변적으로 보여준 한 해였습니다. 먼저 정치적 차원에서 보면, 영국이 국민투표를 통해 브렉시트를 결정했고, 미국에서는 정치적 이방인인 도널드 트럼프가 대통령에 당선되는 등 선진국의 정치 지형이 급격하게 변하고 있습니다. 산업 구조의 변화에 따른 고용 구조의 변화, 부의 양극화 등으로 인한 상대적 박탈감이 높아지면서 거센 정치적 변화를 만들어 내고 있습니다.    ', '4차 산업혁명으로 표현되는 새로운 산업 트렌드도 더욱 가속화되고 있습니다. 인공지능(AI) 알파고와 이세돌 9단의 세기의 바둑 대결이 보여주었듯이 4차 산업 혁명은 미래의 일이 아니라 ‘이미 와 있는 미래’ 입니다. 인공지능, 모바일 네트워크, 바이오, 무인자동차, 신에너지 등은 우리의 삶과 라이프스타일을 근본적으로 바꿔 놓고 있고, 더 많을 것을 바꾸어 놓을 것입니다. 글로벌 tourism도 새로운 경험과 좋은 환경을 소비하고자 하는 인구가 폭발적으로 증가하면서 커다란 성장을 하고 있습니다. ', '‘거대한 전환의 시대’에 우리나라 경제는 안타깝게도 야성을 잃어가며 머뭇거리고 있습니다. 지금까지 한국경제의 성장을 견인했던 제조업 기반의 올드 이코노미가 흔들리고 있고, 소비자들의 지갑은 꽁꽁 닫혀 내수시장은 침체의 터널에 빠져 있습니다. 4차 산업 혁명이 현실화되고 있음에도 투자는 지지부진한 상황입니다. ', '미래에셋은 시대적 격변의 현장에서도 2016년에 의미 있는 진전을 이뤄냈습니다. 대우증권과 미래에셋증권이 만나 미래에셋대우로 재탄생했고, 미래에셋생명은 PCA생명을 인수하면서 연금 전문회사로서 한 단계 take off 할 수 있는 힘을 축적했습니다. 멀티에셋자산운용과 에너지인프라자산운용, 모바일 플랫폼 iAll을 출범시켰습니다.', '지난 10여 년간 힘을 기울여온 글로벌 투자도 이제 꽃을 피워나가고 있습니다. 미래에셋자산운용의 전체 자산 중 해외운용자산의 비중은 28%입니다.  이런 성과는 모두 미래에셋을 믿고 지금까지 함께해 주신 고객 여러분과 직원 여러분 그리고 주주 여러분의 지지와 응원 덕분입니다. 이 자리를 빌려 다시 한 번 깊은 감사의 마음을 전합니다.  ', ' 미래에셋 임직원 여러분! ', '미래에셋은 지금부터 20년 전인 1997년에 이 세상에 태어났습니다. 20년 전 당시의 모습이 영화의 한 장면처럼 떠오릅니다. 창업을 준비하면서 줄곧 ‘어떤 회사를 만들어야 하나?’라는 화두를 갖고 있었습니다. 건물을 짓기보다 도시를 건설한다는 개념을 갖고 고민에 고민을 거듭했습니다. 저는 미래에셋의 DNA를 ‘투자’라고 생각했습니다. 미래에셋그룹은 투자를 통해 성장하고, 사회에 기여하고, 고객 여러분을 행복하게 해 주는 회사가 되어야 한다고 생각했습니다. 창업 때부터 단 한 번도 ‘투자’라는 미래에셋 비즈니스의 DNA를 잊은 적이 없습니다. ', '투자 없는 성장은 존재할 수 없습니다. 투자는 자본에 모험정신과 야성을 불어 넣는 일입니다. 자본에 모험정신과 야성이 없었다면, 역사는 한 걸음도 나아가지 못했을 것입니다. 모험정신과 야성이 있는 자본이 있었기에 16세기에 ‘대항해 시대’가 열렸고, 그 뒤를 이어 18세기에는 ‘산업혁명’이 일어날 수 있었습니다. 미국이 글로벌 금융위기의 진원지였음에도 다시 경제의 생동감을 회복할 수 있었던 이유도 모험정신과 야성을 가진 자본이 있었기 때문입니다.', '2008년 이후 양적완화와 마이너스 금리로 표현되는 초유의 통화정책과 재정정책에도 세계 경제는 여전히 장기침체에 대한 두려움을 갖고 있습니다. 단순히 비용을 줄이는 방식으로 기업을 경영하면 당장 몇 년간은 생존할 수 있을 것입니다. 하지만 이런 식의 접근법은 임시 처방전일 뿐 장기 생존 전략될 수 없습니다. 미래에셋대우를 창업하면서 구조조정과 같은 비용 절감의 방식이 아닌 투자를 통한 성장을 강조한 것도 미래에셋대우가 한국 자본시장의 야성과 모험정신을 불러일으킬 수 있다는 확고한 믿음과 전략을 갖고 있었기 때문입니다.   ', '시대적 변화도 투자를 통한 모험정신과 야성의 부활을 요구하고 있습니다. 1980년대 말 이후 super debt cycle이 종언을 고하고 있습니다. 2008년 금융위기의 본질은 부채의 위기입니다. 돈을 빌려 성장률을 도모할 수 있는 시대는 과거 속으로 사라지고 있습니다. super debt cycle의 종언은 equity 시대를 알리는 전조입니다. 우리 앞에는 가슴 뛰는 equity의 시대가 오고 있습니다. ', '4차 산업 혁명으로 새로운 산업도 성장하고 있어 앞으로 equity의 성장은 무궁무진할 것입니다. equity의 시대는 저희에게 커다란 기회가 될 것입니다. 미래에셋이 equity 투자를 통해 우리나라의 새로운 산업에 씨를 뿌리고 장기적인 성장에 함께 해야 합니다. ', '미래에셋 가족 여러분! ', '창업 이래 지난 20년 간, 한국자본시장에서 우리가 걸어온 길이 곧 새로운 길이었습니다. 하지만 지금부터 지난 20년의 성공을 잊어야 합니다. 과거의 성공이 미래의 성공에 걸림돌이 될 수도 있다는 게 국가나 기업 역사의 교훈임을 잊지 말아야 할 것입니다. 다시 초심으로 돌아가 투자의 야성을 갖고 제2의 창업에 나서야 합니다. ', '먼저 고객 동맹의 의미에 대해 깊이 생각해 봐야 합니다. 미래에셋의 가치 판단 기준은  ‘For the Client‘ 입니다. 미래에셋은 ’고객이 원하는 것‘을 넘어 ’고객을 위한 것‘을 해야 합니다. 그러기 위해서는 고객에게 정직해야 합니다. 고객의 파트너로서 최적의 자산배분을 진솔하게 말씀드리고, 고객 수익 증대를 위해 노력하는 것입니다. ', '미래에셋은 16개국에 진출해 있는 글로벌 투자그룹입니다. 미래에셋은 국내에서 유일하게 글로벌 투자 플랫폼을 갖춘 그룹입니다. 앞으로 글로벌 자산배분과 글로벌 브로커리지를 통해 우량자산을 고객 여러분께 정직하게 공급하겠다는 고객 동맹의 노력을 게을리 하지 말아야 할 것입니다. ', '미래에셋은 미래에셋대우의 출범으로 명실 공히 한국 자본시장을 대표하는 투자그룹이 되었습니다. 조직의 규모가 커질수록 그에 비례해 높은 수준의  리스크관리와 컴플라이언스가 요구된다는 점을 명심해야 할 것입니다. 고객의 이익에 반하는 어떠한 것도 미래에셋 안에 자리 잡지 못하도록 항상 깨어 있어야 합니다. ', '연금 비즈니스는 아무리 강조해도 지나치지 않습니다. 연금 비즈니스는 한국 자본시장에서 최대 성장 비즈니스 중 하나입니다. 상품, 컨설팅, 자산배분 등 연금 관련 전 부문에서 뛰어난 경쟁력을 유지해야 합니다. 저금리와 수명 증가로 인해 연금 시장은 저축에서 투자로 바뀔 수밖에 없습니다. DB형에서 DC, IRP 중심으로 중심축이 옮겨갈 것이 자명합니다. 투자를 통해 고객의 평안한 노후에 기여하겠다는 확고한 사명감을 가져야 합니다. ', '미래에셋 임직원 여러분!  ', '미국의 플랭클린 루스벨트 대통령은 대공황의 어두운 그늘이 가득했던 1930년대 초 “우리가 두려워해야 할 것은 두려움 그 자체이다”라고 말한 바 있습니다. 경제 여건이 어렵다고 두려움에 사로잡혀 움츠리고 현재에 안주하려 한다면, 우리에게 미래는 오지 않을 것입니다. 저는 오늘 이 자리에서 다시 10년 후 미래에셋의 미래를 꿈꾸고자 합니다.      ', '고객께 노후의 평안함을 드리고 사회를 더 건강하고 행복하게 만들기 위해 투자 회사로서 해야 할 일을 거듭 생각합니다. 스티브잡스의 스탠포드 연설 말미에 있는 구절. ‘Stay hungry’ 익숙한 것, 관행적인 것과 결별해야 합니다. 열린 마음으로 미래를 향해 나아가는 permanent innovator가 되어야 합니다.', '언제나  미래에셋은 투자를 통해 대한민국에 새로운 길을 만드는 기업이 되어야 합니다. 젊은이들이 미래에 활동할 수 있도록 토양을 만들어주고 배려가 있는 자본주의의 실천에도 앞장서야 합니다.', '우리가 가는 한 걸음 한 걸음이 대한민국금융의 새로운 길이 된다는 자부심과  소명감을 갖고 창업 20주년을 출발합니다. 미래에셋 앞날에 무한한 영광과 겸손함이  함께 하길 바랍니다. 모든 고객님들, 주주님들, 임직원 여러분 항상 건강하시고 따뜻한 한해 되시기 바랍니다. 감사합니다.', '2017년 1월 2일', '미래에셋 회장', '박현주', '김기훈 (core81@edaily.co.kr)', '\n\t', '\n\t']"
이데일리,['2017.01.02. 오전 10:01'],"['\n\t', '\n\t', '\n\n', '\n', '\n\t\n\t[이데일리 신정은 기자] 르노삼성자동차는 1월 차량 구매 고객에게 설 귀성여비와 노후 경유차 개별소비세(개소세) 지원 등 다양한 혜택을 제공한다고 2일 밝혔다. ', '르노삼성은 설을 맞아 18일까지 SM3, SM6, QM6를 출고하는 고객에게 각각 50만원, 60만원, 30만원 귀성여비를 지원한다. 특히 중형 SUV QM6 구매고객은 귀성여비 외에도 패키지 할부 상품인 밸류박스와 함께하는 저리할부를 이용하면 지난해 보다 인하된 최저금리 할부 혜택(4.0%·36개월, 5.5%·48개월, 6.0%·60개월)을 받을 수 있다. ', '현금 구매 할인혜택도 이어간다. SM3는 20만원을 할인하고, QM3는 70만원, SM7(택시·프리미엄 컬렉션 제외)와 SM5 고객에 대해서는 50만원의 할인 혜택을 각각 제공한다. 할부 구매 시에는 SM3와 QM3는 저금리로 구입할 수 있는 일반 할부 프로그램과 스마트 잔가보장 할부가 선택 가능하다. 특히 QM3는 여기에 40만원을 더 할인해준다.', '또한 지난달 시행했던 노후 경유차 잔여 개소세 지원 혜택을 1월에도 이어간다. 최초 등록 이후 10년이 지난 노후 경유차를 말소 등록하고 신규 승용차를 구입하는 고객은 정부 지원에 따른 개소세 인하(70%)에 르노삼성의 잔여분 지원(30%)까지 합쳐 개소세 완전면세 효과를 누리게 된다. ', '이에 따라 1월 다양한 혜택과 연계하면 SM6의 경우 214만~261만원, QM6는 183만~218만원, QM3는 193만~208만원의 할인혜택을 받을 수 있다. SM7의 경우 최대 242만원, SM5와 SM3는 각각 최대 171만원, 187만원 가량의 할인 혜택이 제공된다. ', '아울러 중형 세단 SM6는 2016 안전한 차에 선정된 기념으로 ‘해피케어 4년 보증연장 서비스’ 무상 제공 또는 20만원 추가 할인 혜택을 이어간다. 여성 고객에 한해 스크래치, 덴트 등 생활 긁힘에 대한 ‘스마트 리페어 프로그램’ 무상 지원 등 다양한 혜택을 제공받을 수 있다.', '신정은 (hao1221@edaily.co.kr)', '\n\t', '\n\t']"
이데일리,['2017.01.02. 오전 10:10'],"['\n\t', '\n\t', '\n\n', '\n', '\n\t\n\t', '[이데일리 오희나 기자] 이진국 하나금융투자 사장은 “새로운 하나금융투자의 원년으로 만들기 위해 생각과 일하는 방법을 혁신하자”고 강조했다. ', '이진국 하나금융투자 사장은 2일 신년사를 통해 “올해는 금리 상승과 정치적 혼란 등 불확실성과 변동성이 더욱 커질 전망”이라며 “이를 극복하고 지속 성장하기 위해  변화와 혁신이 필요하다”며 이같이 밝혔다. ', '이 사장은 “하나금융투자의 임직원들은 증권업계의 몽골기병이 돼야 한다”며 “이를 위해서는 3S-Speed(발빠른 실행), Simple(간편한 해법), Spirit(강인한 정신)이 필요하다”고 강조했다. ', '몽골이 13세기에 기병을 앞세워 유라시아에 걸친 대제국을 건설했을 때 몽골의 총인구는 100만명이었고, 점령지 인구는 약 1억이었다며,  전세계를 제패한 10만명의 몽골기병처럼 생각과 일하는 방식을 바꾸자고 부연했다. ', '또한 조금 더 빨라지고, 조금 더 간편해지고, 조금 더 강인해지는 선택의 기로에서는 항상 투철한 윤리의식을 판단기준으로 삼아달라고 주문했다.', '다음은 신년사 전문이다. ', '사랑하는 하나금융투자 가족 여러분, 2017년 정유년 새해가 밝았습니다. ', '모든 임직원 여러분의 가정에 건강과 행복이 가득한 한 해가 되기를 기원합니다.', '지난 2016년은 브렉시트와 미국 대선에서의 트럼프 당선 그리고 국내의 정치적 혼란 등 금융시장을 요동치게 하는 큰 이벤트로 인해 어려움이 많았던 한 해였습니다.', '2017년 또한 금리 상승과 정치적 혼란 등 불확실성과 변동성이 더욱 커질 전망입니다.', '저는 하나금융투자가 이런 상황을 극복하고, 지속적으로 성장하기 위해서는  변화와 혁신이 필요하다고 판단했고, 이에 따라 대대적인 조직 개편과 인사발령에 그 의지를 담았습니다.', '하나금융투자 임직원 여러분. ', '단순히 조직을 개편하고 사람만 바꾼다고 해서 쇄신과 혁신이 이루어질 수는 없습니다. ', '이제는 생각과 일하는 방법을 혁신해야 합니다.', '우리 하나금융투자의 임직원들은 증권업계의 몽골기병이 되어야 합니다.', '몽골이 13세기에 기병을 앞세워 유라시아에 걸친 대제국을 건설했을 때, 몽골의 총인구는 100만명 이었고, 점령지 인구는 약 1억이었습니다. ', '우리도 전세계를 제패한 10만명의 몽골기병처럼 생각과 일하는 방법을 Speed, Simple, Spirit의 세 가지 승리의 비결로 혁신해야만 합니다.', '이러한 3S 중에서 첫 번째는 Speed, 즉 “발빠른 실행”입니다. ', '경쟁사보다 먼저 결정하고, 즉시 실행해야 합니다. ', '신속한 의사결정을 위해서 치열하게 사고하고 논쟁하되, 일단 결정된 사안은 일사분란하게 실행해야겠습니다.', '두 번째는 Simple, 즉 “간편한 해법”입니다. ', '발빠른 실행 즉 신속성은 간편성에서 나옵니다. ', '일선의 직원도 전략이 Simple해야 쉽게 이해하면서 실천할 수 있고, 손님도 이해하기 간편한 해법일수록 의사결정을 쉽게 할 수 있을 것 입니다.', '세번째는 Spirit, 즉 “강인한 정신”입니다. ', '일단 목표가 정해지면 하고야 말겠다는 일념을 가지고 도전하는 강한 정신력이 있어야 불확실성의 두려움을 이겨낼 수 있습니다.  ', '이 세가지에 하나를 더 붙인다면 성숙한 하나금융그룹, 하나금융투자의 일원으로서 투철한 윤리의식을 지켜나가야만 합니다. ', '목표달성을 위해 달려가는 중에 많은 유혹과 위험, 한계라는 도전이 다가오게 될 것입니다. ', '조금 더 빨라지고, 조금 더 간편해지고, 조금 더 강인해지는 선택의 기로에서는 항상 투철한 윤리의식을 판단기준으로 삼아주시기 바랍니다.', '사랑하는 임직원 여러분,', '2017년 정유년은 우리에게 위기이자 기회가 될 것입니다.', '기회는 준비된 자에게 그리고 의지 있는 자에게 주어지는 것입니다. ', '우리 함께 불확실성의 어둠 속에서 새벽을 여는 빛을 부르는 “희망과 개벽의 붉은 닭”이 됩시다. ', '2017년 한 해를 끊임없이 혁신하고 도전해서 금융산업에서의 혁신기업으로 판을 바꾸는 새로운 하나금융투자의 원년으로 우리 모두 다 함께 만들어 나갑시다.', '감사합니다.', '오희나 (hnoh@edaily.co.kr)', '\n\t', '\n\t']"
연합뉴스,"['2017.01.02. 오전 9:28', '2017.01.02. 오전 10:20']","['\n\t', '\n\t', '\n\n', '\n', '\n\t\n\t', '(서울=연합뉴스) 지난 2016년은 브렉시트와 미국 대선에서의 트럼프 당선 그리고 국내의 정치적 혼란 등 금융시장을 요동치게 하는 큰 이벤트로 인해 어려움이 많았던 한 해였습니다.', '    2017년 또한 금리 상승과 정치적 혼란 등 불확실성과 변동성이 더욱 커질 전망입니다.', '    저는 하나금융투자가 이런 상황을 극복하고, 지속적으로 성장하기 위해서는 변화와 혁신이 필요하다고 판단했고, 이에 따라 대대적인 조직 개편과 인사발령에 그 의지를 담았습니다.', '    우리 하나금융투자의 임직원들은 증권업계의 몽골기병이 되어야 합니다. 몽골이 13세기에 기병을 앞세워 유라시아에 걸친 대제국을 건설했을 때, 몽골의 총인구는 100만명 이었고, 점령지 인구는 약 1억이었습니다. 우리도 전 세계를 제패한 10만명의 몽골기병처럼 생각과 일하는 방법을 발 빠른 실행, 간편한 해법, 강인한 정신 등 세 가지 승리 비결로 혁신해야만 합니다. ', '    이 세 가지에 하나를 더 붙인다면 성숙한 하나금융그룹, 하나금융투자의 일원으로서 투철한 윤리의식을 지켜나가야만 합니다. ', '    2017년 정유년은 우리에게 위기이자 기회가 될 것입니다. ', '    기회는 준비된 자에게 그리고 의지 있는 자에게 주어지는 것입니다. ', '    2017년 한 해를 끊임없이 혁신하고 도전해서 금융산업에서의 혁신기업으로 판을 바꾸는 새로운 하나금융투자의 원년으로 우리 모두 다 함께 만들어 나갑시다.', '\n\t', '\n\t']"
이데일리,"['2017.01.02. 오전 8:51', '2017.01.02. 오전 9:00']","['\n\t', '\n\t', '\n\n', '\n', '\n\t\n\t', '[이데일리 임성영 기자] 현대자동차가 올해 글로벌 판매량 목표로 508만대를 제시했다. 지난해대비 7만대(1.4%) 증가한 수치다.', '윤여철 현대자동차(005380) 부회장은 2일 양재동 본사 사옥에서 열린 2017년 시무식 행사에서 “모든 임직원은 창의적이고 도전적이며 적극적인 자세로 소통해 올해 생산량 508만대를 달성해야 한다”며 “창립 50주년이 되는 올해가 재도약 하는 원년이 되길 바란다”고 밝혔다. ', '올해 판매량으로 제시한 508만대 중 내수 68만3000만대, 해외 시장 439만7000508만대다. ', '이날 정몽구 현대차그룹 회장은 시무식에 참석하지 않았으며 현대차가 먼저 시무식을 진행하고 기아차는 8시 50분부터 진행할 예정이다.', '윤 부회장은 올해 자동차 시장 경쟁이 예년보다 경쟁이 더욱 심화할 것으로 내다봤다. 그는 “저유가와 신흥국 시장 경기둔화, 미국 금리 인상, 신정부 출범 등으로 자동차 시장의 성장세는 더욱 둔화할 것”이라고 전망했다.', '이어 그는 “최근 자동차 시장에선 과거 우리가 경험하지 못했던 근본적인 변화가 나타나고 있다”면서 “사물인터넷 인공지능 발달로 커넥티비티와 자율주행이 자동차 핵심 요소로 자리잡고 있는 가운데 공유경제 트렌드가 확산되면서 고객의 자동차 이용 패턴도 변화하고 있다”고 설명했다.', '윤 부회장은 “올해 출시하는 다양한 신제품과 상품성 강화모델을 적극 활용해 침체된 시장 공략해야 한다”고 강조했다. 지난해 내수에서 성공적으로 런칭한 그랜저 판매 모멘텀 이어가는 한편 올해 강화되는 SUV와 승용차 상품성 강화 모델을 바탕으로 판매 확대의 전환점으로 삼하야 한다고 덧붙였다.', '또한 그는 “고급차 브랜드 제네시스와 고성능차 N라인이업을 시장에 안착시켜 고객의 기대에 부응해야 한다”고 말했다.', '마지막으로 윤 부회장은 “품질과 고객 우선을 최고로 삼아야 한다”면서 “글로벌 최고 수준의 품질과 최첨단 안전기능을 통해 어떠한 상황도 예방하고 고객 생명 보호하는 브랜드 되어야 한다”고 당부했다.', '임성영 (rosa8341@edaily.co.kr)', '\n\t', '\n\t']"
