media,time,body이데일리,['2017.01.02. 오후 2:00'],"['\n\t', '\n\t', '\n\n', '\n', '\n\t\n\t', '[이데일리 김경은 기자] 광주은행은 은행 방문없이 스마트뱅킹(My CoolBank)앱에 모바일로 대출을 받을 수 있는  ‘쏠쏠한 개인신용대출’ 상품을 출시했다고 2일 밝혔다. ', ' ‘쏠쏠한 개인신용대출’은 무직자(신용등급 1~7등급) 또는 직장인 모두 신청이 가능한 상품으로 최대 1500만원까지 대출을 받을 수 있다. 여러 대출상품 중에서 고객이 비교분석 후 선택하던 기존 방식에서 벗어나, 고객 신용등급과 재직여부에 따라 금액과 금리를 제시해주고 고객이 최적의 조건을 선택할 수 있도록 편리성을 강화했다.', '또한 복잡한 인증절차 없이 간단한 휴대전화 인증만으로 신용등급에 영향없이 간편하게 한도 조회가 가능하고, 직장인의 경우 제출서류 없이 소득증빙이 가능하도록 모바일 신기술을 적용하여 대출신청 시간을 획기적으로 단축해서, 스마트뱅킹을 평상시 활용하던 고객이라면 1분 안에 한도조회 및 5분 안에 대출신청이 가능하다.', '이와 더불어 은행 창구업무에 필요한 증빙서류를 모바일로 제출할 수 있는 ‘서류제출서비스’를 함께 출시하여, 납세사실증명서, 건강보험 자격득실 확인 및 납부확인서, 주민등록 등/초본 등 10여가지 서류 및 개인신용정보활용동의서, 신분증을 모바일로 실시간 제출이 가능하여 고객의 서류제출에 대한 불편을 해소할 수 있는 서비스이다. ', '송종욱 광주은행 부행장은 “비대면 채널 서비스를 점진적으로 확대하고 비대면 채널과 영업점간의 연계(O2O) 및 고객경험을 반영한 프로세스 개선 등을 통해, 고객의 편의성을 최우선으로 지향하는 광주은행이 되겠다”고 밝혔다.', '김경은 (ocami81@edaily.co.kr)', '\n\t', '\n\t']"
이데일리,"['2017.01.02. 오후 1:51', '2017.01.02. 오후 2:22']","['\n\t', '\n\t', '\n\n', '\n', '\n\t\n\t', '[세종=이데일리 김상윤 기자] 유일호 부총리 겸 기획재정부 장관은 2일 “경제는 정치와 별개의 논리와 생명력을 가진다”면서 “주변 상황에 관계없이 오로지 국민만을 바라보고 경제 정책을 흔들림없이 추진해야 한다”고 밝혔다.', '유 부총리는 이날 정부세종청사에서 기재부 시무식을 갖고 “기재부가 우리 경제의 중심추가 되어야 한다”며 직원들에게 당부했다.', '유 부총리는 “지금 우리 경제는 대내외 도전들을 극복하고 앞으로 나아가느냐, 이대로 주저앉고 마느냐하는 절체절명의 변곡점에 놓여 있다”고 현 상황을 진단했다. 미국이 빠른 금리인상을 예고한 가운데 트럼프 신(新) 정부는 보호무역주의 강화로 세계 무역질서의 판도를 뒤흔들 것이라는 예상이다. ', '대내적으로도 수출에 이어 내수마저 꺾일 것이라는 우려가 큰 가운데 경기 둔화로 일자리 여건이 악화되고 있지만 다가오는 4차 혁명에 제대로 대응조차 못하고 있는 상황이다. 이에 유 부총리는 “위기를 기회로 삼아 새로운 도약을 이뤄야 한다”며 “리스크 관리, 경기회복과 민생안정, 미래대비 등에 모든 역량을 결집해야 한다”고 강조했다.', '유 부총리는 이례적으로 사자성어를 토대로 직원들에게 당부의 말을 전했다.', '그는 먼저 처음부터 끝짜기 변하지 않는다는 ‘일이관지(一以貫之)’자세로 정치적 불확실성과 별개로 국민을 위한 경제 정책이 흔들리지 않고 시행돼야 한다고 강조했다. 조선시대 최고의 개혁으로 불리는 대동법이 정치적 혼란기였던 숙종 시대에 완성됐다는 것을 예시로 들었다.', '또 유 부총리는 “민생을 지키는 파수꾼이 되어야 한다”면서 “경제정책이 국민들의 삶의 질을 개선하고 서민생활을 안정시키는 데 둬야 한다”고 강조했다. 그는 경제는 세상을 다스려 백성들을 어려움에 벗어나게 한다는 ’경세제민(經世濟民)’의 준말이라는 점을 들며 국민에 초점을 잡고 정책을 펼쳐야 한다는 것을 설명했다. 유 부총리는 “난무하는 주장 속에서 이를 가려듣기가 매우 어렵다”면서 “항상 민생현장에서 호흡하고 핵심에 집중해야 한다”고 말했다.', '아울러 “우리 경제의 안전판이 되어 달라”면서 “올 한해 예기치 못한 리스크가 불거질 경우를 대비해 즉각 대응할 수 있도록 대응책을 촘촘히 가다듬자”고 당부했다.', '마지막으로 그는 이순신 장관이 부하들에게 했던 말을 언급하며 각오를 다짐했다. 유 부총리는 “명량해전 하루전날 이순신 장군이 부하들에게 ‘일부당경 족구천부(一夫當逕 足懼千夫)’ 즉, 한사람이 지키면 능히 천명을 두렵게 할 수 있다는 말로 각오를 다졌다”면서 “일당천의 자세로 우리 경제의 도전요인에 맞서자”고 강조했다.', '김상윤 (yoon@edaily.co.kr)', '\n\t', '\n\t']"
이데일리,['2017.01.02. 오후 1:38'],"['\n\t', '\n\t', '\n\n', '\n', '\n\t\n\t', '[이데일리 오희나 기자] 최석종 KTB투자증권(030210) 대표는 “‘NEW KTB금융그룹 중장기 성장의 기틀마련’이라는 목표를 향해 본격적으로 전진하는 한 해를 만들 것”이라고 강조했다.  ', '최 대표는 2일 신년사를 통해 “글로벌 매크로 환경과 상품시장은 급변하고 있고, 국내 경제도 한 치 앞을 내다보기 어려운 상황”이라며 이에 “다섯 가지 목표를 설정하고 전사적 역량을 집중하자”면서 이같이 밝혔다. ', '최 대표는 △IB부문 집중 육성 △기존 강점 극대화해 안정적인 수익성 확보 △미래 수익 창출 위한 새로운 시도 △성장의 걸림돌인 재무적 이슈 해소 △각 계열사 흑자전환, 각자 특화영역에서 선도적 지위 확보 등 5가지 목표를 주문했다. ', '그는 “핵심 사업으로 IB부문을 집중 육성해야 한다”면서 “모두가 경쟁하는 시장에서 벗어나 대형사와 차별화 된‘KTB만의 IB’를 개척해 나감으로써, 진정한 특화증권사가 돼야 할 것”이라고 강조했다. ', '또한 중기특화증권사 지정 등 각종 라이선스를 확보하고 지원 프로세스도 확연히 개선해 나가야 한다고 부연했다. ', '이어 “성장의 걸림돌이 되고 있는 재무적 이슈들을 해소해야 한다. 신용등급 상향을 통해 자금조달 비용 절감은 물론, 영업기반 확대와 신 수익원 창출의 기반을 마련해야 한다”며 “올 한해는 다양한 방법의 재무구조 개선을 통해 반드시 주주가치를 제고해야 할 것”이라고 말했다. ', '최 대표는 “올해는 모든 계열사가 손익 측면뿐만 아니라 질적인 면에서도 괄목상대할 성장을 이룩해 나가는 한 해가 돼야 한다”며 “다섯 가지 목표를 달성하고 새로운 중장기 성장의 발판을 반드시 만들어 낼 것”이라고 강조했다. ', '다음은 신년사 전문이다', 'KTB금융그룹 가족 여러분 정유년 새해가 밝았습니다. ', '올 한해 임직원 모두의 가정에 평안과 행복이 깃들기를 기원합니다.', '아울러, 지난 해 어려운 영업환경 속에서도 변화와 도전을 통해 더 좋은 회사를 만들어 나가는데 동참해 주신 임직원 여러분의 노고에 깊이 감사 드립니다.', '최근 국내외 경제상황은 안팎으로 많은 변화에 처해 있습니다.', '장기간 지속되던 글로벌 저금리 시대가 끝나가고 있고 미국과 중국 등 강대국의 자국보호 무역주의는 더욱 확산될 것으로 보입니다. ', '국내 상황은 더 심각합니다. ', '1,400조를 돌파한 가계부채와, 주력산업의 수출 부진, 내수 둔화까지 겹쳐 어느 때 보다 불확실성이 커지고 있습니다. ', '우리 금융투자업계는 주식 거래량 감소와 수수료율 하락 등 기존 사업이 구조적 한계를 보이고 있고, 대형사들은 잇달아 합병과 자본확충에 나서며 중소형사와의 격차를 더욱 벌리고 있습니다. ', '이런 어려운 상황에도 불구하고 지난해 임직원 여러분의 노력을 통해, 소폭이나마 2년 연속 성장추세를 유지하고 신규 사업 조직을 확대 한 것은 매우 의미 있는 성과라고 생각합니다. ', '이제 새롭게 시작하는 2017년은, 지난 6개월여간 진행했던 준비과정을 마무리하고 「NEW KTB금융그룹 중장기 성장의 기틀마련」이라는 목표를 향해 본격적으로 전진하는 한 해가 되었으면 합니다. ', '이에 우리는 다음의 다섯 가지 목표를 설정하고 전사적 역량을 집중하고자 합니다.', '첫째, 당사의 핵심 사업으로 IB부문을 집중 육성해야 합니다.', '모두가 경쟁하는 시장에서 벗어나 대형사와 차별화 된‘KTB만의 IB’를 개척해 나감으로써, 진정한 특화증권사가 되어야 할 것입니다.', '이를 위해 적극적으로 상품영역을 확대하고 해외시장의 문을 두드려, 실질적인 수익을 확보해야 합니다. ', '또한, 중기특화증권사 지정 등 각종 라이선스를 확보하고 지원 프로세스도 확연히 개선해 나가야 합니다. ', '둘째, 기존 강점은 극대화해서 안정적인 수익성을 확보해야 합니다. ', '브로커리지와 자산운용 부문은 금리 상승, 수수료 하락 등으로 어려운 영업환경에 처해있습니다. ', '하지만, 우수인력 확보와 탄력적인 시장 대응을 통해 안정적인 수익원을 확보하는 한편, 향후 고수익 분야를 개척하여 성장 기반을 만들어야 할 것입니다. ', '셋째, 미래 수익 창출을 위한 새로운 시도를 지속해야 합니다. ', '새로운 상품과 서비스 의 개발은 물론, 신규시장 진출, 고객기반 확대 등 핵심 과제들을 차질 없이 진행하여, 중장기 성장의 기회를 반드시 마련해야 합니다.', '넷째, 성장의 걸림돌이 되고 있는 재무적 이슈들을 해소해야 합니다', '우선, 신용등급 상향을 통해 자금조달 비용 절감은 물론, 영업기반 확대와 신 수익원 창출의 기반을 마련해야 합니다.', '다행이 최근 계열사에서 주요 투자자산의 매각이 이루어지는 등 신용등급에 긍정적 영향을 미칠 소식이 이어지고 있습니다. ', '올 한해는 다양한 방법의 재무구조 개선을 통해 반드시 주주가치를 제고해야 할 것입니다. ', '다섯째, 각 계열사는 흑자전환에서 나아가, 각자의 특화영역에서 선도적 지위를 확보해 나가야 합니다. ', '지난해 국내 계열사는 물론, 태국 현지 증권사인 KTB ST까지 흑자 전환에 성공하였습니다. ', '올해는 여기서 나아가, 국내외 전 계열사가 대표상품을 육성하고, 각자 특화분야에서 시장지배력을 확대하여, 한단 계 도약할 수 있는 기반을 구축해야 합니다. ', '2017년은 모든 계열사가 비단 손익 측면뿐만 아니라 질적인 면에서도 괄목상대할 성장을 이룩해 나가는 한 해가 되어야 하겠습니다.', '마지막으로 강조하고 싶은 것은 계열사 간 시너지 입니다.', '각 계열사가 가진 제한된 자원, 고객, 평판 하에서, 효율적 시너지를 통한 그룹 역량의 극대화는 반드시 이뤄가야 할 과제 입니다.', 'KTB금융그룹 임직원 여러분', '올해도 금융환경은 결코 녹록하지 않을 것으로 예상됩니다. ', '글로벌 매크로 환경과 상품시장은 급변하고 있으며, 국내 경제도 한 치 앞을 내다보기 어려운 상황입니다.', '그러나 변화 속에 항상 기회는 있습니다.', '임직원 여러분 모두가 리더이자 주인으로서 각자의 미션을 완수하고, 서로 협력한다면, 저는 올해 우리가 다섯 가지 목표를 달성하고 새로운 중장기 성장의 발판을 반드시 만들어 낼 것이라 확신합니다.', '저도 가장 앞에 서서 함께 뛰겠습니다.', '그 동안 몇 번의 위기 속에서 최선의 결과를 얻을 수 있었던 것은, 한 마음으로 뭉친 임직원 여러분의 노력이 있었기 때문이었습니다. ', '2017년 정유년, 변화와 도전의 한 해로 각자 자부심과 주인의식을 가지고 업무에 임해주시길 당부 드립니다. ', '마지막으로, 올 한해 임직원 여러분과 여러분 가정의 행복과 건강을 다시 한번 기원합니다. ', '임직원 여러분!', '새해 복 많이 받으십시오', '대표이사 사장 최석종', '오희나 (hnoh@edaily.co.kr)', '\n\t', '\n\t']"
연합뉴스,"['2017.01.02. 오후 1:51', '2017.01.02. 오후 1:54']","['\n\t', '\n\t', '\n\n', '\n', '\n\t\n\t', '기재부 시무식서 밝혀', '(세종=연합뉴스) 박대한 기자 = 유일호 부총리 겸 기획재정부 장관은 2일 ""위기를 기회로 삼아 새로운 도약을 이룰 수 있도록 리스크관리, 경기회복과 민생안정, 미래 대비 등에 모든 역량을 결집해야 한다""고 밝혔다.', '    유 부총리는 이날 정부세종청사에서 열린 기재부 시무식에서 ""지금 우리 경제는 대내외 도전을 극복하고 앞으로 나아가느냐, 이대로 주저앉고 마느냐 하는 절체절명의 변곡점에 놓여 있다""며 이같이 말했다.', '    유 부총리는 ""우리 경제는 악조건 속에서도 지난해 인구 1천만 명, 국민소득 2만 달러 이상 12개 국가 중 3위의 성장률과 함께 30만 명 수준의 고용을 지켜냈지만 국민께서 느끼시는 체감경기는 매우 팍팍한 것을 잘 알고 있다""고 말했다.', '    그는 정유년 새해 우리 경제에는 미국의 예상보다 빠른 금리인상 전망과 신정부의 통상정책 변화, 대내외 불확실성 확대에 따른 경기 둔화, 4차 산업혁명 등의 구조전환 등 많은 도전과제가 밀려올 것으로 전망했다.', '    이와 관련해 위기 대비 안전판을 튼튼히 구축하고 경기 위축 흐름을 조기에 끊어내는 한편 미래 대비에도 한 치의 소홀함이 없어야 한다고 주문했다.', '    유 부총리는 ""정치적으로 불안정한 시기를 지나고 있지만, 경제는 정치와 별개의 논리와 생명력을 가진다""면서 ""주변 상황에 관계없이 오로지 국민만을 바라보고 경제정책을 흔들림 없이 추진해야 한다""고 말했다.', '    조선 시대 최고의 개혁이라 일컬어지는 대동법이 정치적 혼란기였던 숙종 시대에 완성됐듯이 국민만을 바라보고 흔들림 없는 경제정책을 추진해야 한다고 강조했다.', '    그는 이순신 장군이 명량해전 출전에 앞서 부하들에게 말한 \'일부당경 족구천부(一夫當逕 足懼千夫·한 사람이 지키면 능히 천 명을 두렵게 할 수 있다)\'라는 말을 인용하면서 ""기재부가 무너지면 우리 경제도 무너진다는 비상한 책임감과 긴장감으로 올 한해를 헤쳐나가자""고 당부했다.', '    pdhis959@yna.co.kr', '\n\t', '\n\t']"
연합뉴스,['2017.01.02. 오후 1:50'],"['\n\t', '\n\t', '\n\n', '\n', '\n\t\n\t', ""(서울=연합뉴스) 박의래 기자 = 세람저축은행은 새해를 맞아 1월 한 달 동안 연 3.3% 금리를 지급하는 '꼬끼오 적금'을 출시한다고 2일 밝혔다. "", '    이 상품은 경기도 이천 본점과 분당 지점의 창구 방문 고객을 대상으로 하며 개인당 월 100만원까지 불입할 수 있다. ', '    가입 기간은 12∼24개월이다.', '    laecorp@yna.co.kr', '\n\t', '\n\t']"
이데일리,['2017.01.02. 오후 1:58'],"['\n\t', '\n\t', '\n\n', '\n', '\n\t\n\t', '[이데일리 송이라 기자] 유창수 유진투자증권 부회장은 초대형 투자은행(IB) 시대의 흐름 속에서 중소형사는 차별화된 경쟁력으로 승부해야 한다고 거듭 강조했다. ', '유 부회장은 2일 신년사를 통해 “현재 금융투자업계는 초대형 IB 육성정책으로 대형사를 중심으로 자본확충, 인수합병(M&A)으로 대응하며 빠른 속도로 재편되고 있다”며 “자기자본 규모에 따라 취급업무 영역에 차이가 나면서 중소형사는 차별화된 경쟁력 없이는 시장에서 설 자리를 잃게 될 것”이라고 지적했다. ', '이에 무엇보다 투자대상을 다양화하고 신규 사업영역을 개척하는게 중요하다고 강조했다. 그는 “주식이나 채권 등 전통자산은 차별화가 없을 뿐 아니라 높은 수익을 기대하기도 어렵다”며 “해외채권과 부동산, 여타 실물자산 등으로 투자를 확대하고 우수한 중소·벤처기업을 발굴하고 투자하는 신기술사업금융업을 적극 추진해 새로운 수익원을 만들어야 한다”고 설명했다. ', '자산관리(WM) 부문 수익의 질적 향상도 주문했다. 고객들에게 다양한 고수익 상품을 제공하고 수익률을 철저히 관리해 고객이 만족하는 회사로 만들고 그 결과가 다시 회사수익으로 돌아오는 선순환 구조를 만들어 나가야만 한다는 것. ', '그는 “2015년에 이어 2년 연속 2000년대 이후 가장 큰 경영성과를 이뤘다”며 “2017년에도 질적 변화를 지속적으로 추진해 목표 자기자본이익률(ROE) 11%를 달성하자”고 다짐했다. ', '다음은 신년사 전문이다. ', '유진금융 가족 여러분! ', '2017년 정유년(丁酉年) 새해를 맞았습니다. 밝은 미래에 대한 굳건한 믿음과 자신감을 가지고 올 한 해를 시작합시다. ', '지난해를 돌이켜 보면, 상반기에는 브렉시트 영향이 있기는 했으나 주식과 채권시장 모두 대체적으로 우호적이었지만, 하반기에는 국내외적인 정치상황의 변화와 함께 금리급등, 코스닥지수 하락, 거래량 감소 등으로 어려운 시장환경이 지속되었습니다. ', '그러나 우리는 지난해에도 2015년에 이어서 2년 연속 2000년대 들어 가장 큰 규모의 경영성과를 이뤄냈습니다. 이러한 성과와 함께, 우리는 질적인 면에서도 진일보했습니다. 먼저 영업측면에서 WM부문은 고객예탁자산이 약 10조원으로 증가하였고 안정적인 수익도 증가하여 체질이 강화되었습니다. 그리고 중국기업인 오가닉티코스메틱을 해외기업 IPO중에서 가장 높은 청약경쟁률로 상장시키는 한편, 해외투자와 해외PEF중개 실적을 높이면서 해외사업에서도 진전이 있었습니다. ', '이와 아울러 중기특화 금융투자회사 선정, 신기술사업금융업 등록, 비정형화부문 실적 증가 등으로 사업구조 재편의 속도를 높였습니다. 경영인프라 측면에서도 아무런 불편함 없이 신사옥에 안정적으로 정착하였고, 단기신용등급 상향으로 조달금리가 인하되었습니다. 그리고 연봉제 도입, 인턴제를 통한 신입직원 채용 등 인사시스템 전반을 개선하였습니다.  ', '하지만, 우리에게는 여전히 과제가 남아있습니다. 고객들에게 다양한 고수익 상품을 적시에 제공하여 고객수익률을 더 높여야 하며, 투자와 운용역량을 강화하고 해외수익 창출을 한 단계 더 레벨업 해야 합니다. 그리고 중장기 경영목표인 2020년 자기자본 1조원을 달성하기 위해서 현재의 수준을 뛰어넘는 성과를 창출해야만 합니다. ', '유진금융 가족 여러분! ', '현재 금융투자업계는 초대형 IB 육성정책으로 대형사를 중심으로 자본확충, M&A로 대응하면서 빠른 속도로 재편되고 있습니다. 자기자본 규모에 따라 취급업무 영역에 차이가 나면서, 중소형사는 차별화된 경쟁력을 갖추지 않고서는 시장에서 설 자리를 잃게 될 것입니다.  ', '우리는 이러한 변화에 대응하여 지금까지 많은 노력을 기울여 왔지만, 우리의 위치를 확고히 하기 위해서는 아직 부족합니다. 지금까지 거둔 성과를 토대로 2017년에도 질적인 변화를 지속적으로 추진해야만 합니다. ', '올해에는 다음의 사항들을 반드시 달성합시다! ', '먼저, 투자대상을 다양화하고 신규 사업영역을 개척합시다. 주식, 채권 등 전통자산은 차별화가 없을 뿐만 아니라, 높은 수익을 기대하기도 어렵습니다. 고객과 회사 모두를 만족시키기 위해서는 기회가 있는 해외채권, 부동산, 여타 실물자산 등으로 투자를 확대해 나가야 합니다. 그리고 우수한 중소·벤처기업을 발굴하고 투자하는 신기술사업금융업을 적극적으로 추진하여 사업영역을 확장하고 새로운 수익원으로 만들어야 합니다. ', '또한, WM부문 수익의 질적인 향상을 도모합시다! 고객들에게 다양한 고수익 상품들을 제공하고 수익률을 철저히 관리하여 고객이 만족하는 회사로 만들고, 그 결과로 고객예탁자산과 회사수익이 증가하는 선순환 구조를 만들어 나가야만 합니다. ', '그리고 해외사업을 한 단계 더 레벨업 합시다! 4년 전부터 추진해 온 해외사업은 성과가 있는 부분도 있지만, 전체적으로는 아직 그 역량이 부족합니다. 지금까지 구축된 기반도 있지만, 기반을 더 확대·강화하고 수익을 높여 미래를 대비해야 합니다. ', '다음으로, 우수인재를 확보하고 육성합시다! 우수인재에 대해서는 아무리 강조해도 지나침이 없기에 그동안 누차 말씀드렸습니다. 아시다시피, 우리에게 가장 중요한 것은 인적자원이기에 전 부문에 걸쳐서 우수인재를 확보하고 육성해 나가는 것은 지극히 당연합니다. ', '마지막으로, 컴플라이언스를 강화합시다! 최근 사회전반에 걸쳐서 투명성과 법규준수가 요구되고 있습니다. 이에 따라 영업방식 또한 관행적 영업에서 차별적인 서비스를 제공하는 영업으로 변화하고 있습니다. 이에 맞추어 우리 모두 컴플라이언스를 생활화해야 합니다. ', '유진금융 가족 여러분! ', '올해는 우리가 도전하고 변화해야 하는 중요한 해입니다. 우수한 인적자원을 기반으로, 지난 2년간의 성과를 초과하는 양적 성장과 함께 질적으로도 변화하여 확고한 성장의 토대를 마련해야 합니다. 최고의 전문가 정신으로 도전합시다! 미래에 대한 믿음과 자신감으로 목표 ROE 11%를 반드시 달성합시다! 중장기 경영목표를 향해 빠르게 나아갑시다!  ', '유진금융 가족 여러분과 여러분 가족 모두에게 건강과 행복이 가득한 한 해가 되기를 진심으로 기원합니다. ', '감사합니다.', '송이라 (rassong@edaily.co.kr)', '\n\t', '\n\t']"
